id;parent_id;Наименование;ИмяФайлаИзображения;Свойства;Документация;Новинка;Спецпредложение;Заголовок;Подзаголовок;КлючевыеСлова;Описание;ТекстОптимизации
111740;;Электротехника;;;;false;false;Купить элетротехнику в Минске по доступным ценам;;;Электротехника с доставкой по Минску и Беларуси в магазине bereg.by. Купить электротехнику по самым низким ценам на нашем сайте!;
114889;111740;Диэлектрическая продукция;;;122274,122275,122273,122365;false;false;Купить диэлектрическую продукцию в Минске, цены, гарантия;Диэлектрическая продукция;;"Диэлектрическую продукцию можно приобрести на сайте ЗАО ""Чистый берег"". Поставляем только качественные товары по доступной цене от лучших производителей.";"<p>Ознакомьтесь со всей представленной <a href=""https://www.bereg.by/cat/111740.html""  title=""Электротехника в Минске"">электротехникой</a> в нашем каталоге.</p>"
111778;111740;Светотехника;Lampa_cvetodiod_PLED_T8_GL_stekl_Electrotexnika.jpg;;;true;false;Купить светотехнику в Минске по доступной цене;Светотехника;;"Светотехнику можно приобрести на сайте ЗАО ""Чистый берег"". Поставляем только качественные товары по доступной цене от лучших производителей.";"<h2>Какой светильник вам лучше выбрать</h2><p>Существуют разные виды ламп освещения, каждая из которых имеет свои особенности. Рассмотрим самые распространенные.</p><h3>Люминесцентные</h3><p><img style=""float: right;"" src=""https://www.bereg.by/i/photo/catalog/Lampa_lyuminiscentnaya_L_G13_Electro.jpg"" alt=""светотехника"" width=""190"" height=""190"" /></p><p>Конструктивно это запаянные с двух сторон стеклянные трубки со слоем люминофора изнутри. Заполняются инертным газом. Также внутри имеется небольшое количество ртути. Принцип действия схож с тем, что используется в стандартных лампах накаливания, но светоотдача и КПД гораздо выше. В процессе работы люминесцентная разновидность разогревается не более чем до 50 С.</p><p>Востребованы варианты серии ЛПО, предназначенные для общего освещения магазинов, офисов, школ, подсобных помещений, функциональных жилых зон, витрин. Светоотдача увеличена на 20%, расход энергии снижен на 25%. Срок службы достигает около 15&nbsp;000 часов, причем в процессе работы светильник не издает звуков.</p><h3>Лампы МО</h3><p>МО означает &laquo;местного освещения&raquo;. Это лампа накаливания, предназначенная для освещения рабочих зон, техники и помещений, если не допускается использование напряжения 127В и 220В. Подключается к сети 12В, 24В, 35В. Пригодна к использованию в местах с повышенной влажностью.</p><h3>Лампы накаливания</h3><p><img style=""float: right;"" src=""https://www.bereg.by/i/photo/catalog/Lampa_nakal_DC_E14_Electro.jpg"" width=""190"" height=""190"" /></p><p>Самые дешевые разновидности. Имеют небольшие размеры, после включения мгновенно достигают максимальной яркости. Значительная часть электроэнергии уходит на разогрев. Использовать такие лампы рекомендуется в случае, когда главным фактором является дешевизна покупки.</p><h3>Светодиодные</h3><p>Современный вариант, пригодный к использованию на любых объектах. В нашей компании вы можете <strong>купить светодиодные светильники с датчиками</strong> &ndash; они автоматически включаются и выключаются в определенных условиях.</p><p>Светодиодные (LED) лампы обладают рядом преимуществ перед другими светильниками.</p><ul><li>Абсолютно безопасны с экологической точки зрения. В них не содержится паров ртути и других вредных для здоровья веществ. Это помогает сэкономить на утилизации.</li><li>Минимальный расход электричества. По сравнению с люминесцентными лампами, LED тратят меньше энергии при аналогичном световом потоке.</li><li>Максимальная яркость сразу после включения, вне зависимости от условий. Многим видам светильников нужно время, чтобы набрать яркость. У светодиодов такой проблемы нет. Более того, свечение интенсивное вне зависимости от температуры окружающего воздуха.</li><li>Минимальный нагрев. Почти вся энергия тратится на освещение, без повышения температуры изделия. Это не только обеспечивает высокий КПД, но и повышает безопасность эксплуатации.</li><li>Устойчивость к перепадам напряжения. В цоколе размещается стабилизатор, который преобразует переменное напряжение в постоянное. Это значит, что свет не будет мерцать при проблемах в сети.</li></ul><h2>Почему с нами выгодно сотрудничать</h2><p>Позвоните нам, чтобы <strong>купить уличные, офисные, промышленные светильники в Минске</strong>. В каталоге компании &laquo;Чистый берег&raquo; представлены разные варианты ламп, от стандартных, с вольфрамовой нитью, до современных LED.</p><p>Предоставляем оперативную доставку в любой город Республики Беларусь. Вся продукция сопровождается полным пакетом подтверждающих качество документов.</p><p>Ознакомьтесь со всей представленной <a href=""https://www.bereg.by/cat/111740.html""  title=""Электротехника в Минске"">электротехникой</a> в нашем каталоге.</p>"
115341;111778;Лампы ИКЗ;;;;false;false;;;;;
115346;111778;Фотореле;;;;false;false;;;;;
115349;111778;Светильники специального назначения;;;;false;false;;;;;
115303;111778;Лампы ДС;;;;false;false;;;;;
115310;111778;Лампы ДНаТ;;;;false;false;;;;;
115319;111778;Лампы ДРЛ;;;;false;false;;;;;
115325;111778;Датчик движения;;;;false;false;;;;;
115328;111778;Лампы ДРВ;;;;false;false;;;;;
115334;111778;Стартер;;;;false;false;;;;;
112497;111778;Лампы накаливания;Lampa_nakal_DC_E14_Electro.jpg;Область применения: осветительный прибор, искусственный источник света^Описание: свет испускается нагретой металлической спиралью при протекании через неё электрического тока^Страна изготовитель: Россия;;false;false;;;;;
112502;111778;Лампы МО;Lampa_nakal_B_E27_Electro.jpg;Область применения: местное освещение рабочих зон, оборудования и помещений ^Описание: лампы накаливания низкого напряжения ^Страна изготовитель: Россия;;false;false;Лампы местного освещения купить в Минске, цены, фото, отзывы;;;Купить лампы местного освещения с доставкой по Минску и Беларуси в магазине bereg.by. Лампы МО по низким ценам. Звоните +375 (17) 279-43-54!;
112505;111778;Лампы люминесцентные;Lampa_lyuminiscentnaya_L_G13_Electro.jpg;Область применения: экономичный источник света для создания рассеянного освещения в помещениях общественных зданий^Производитель: ОАО ""Осрам""^Страна изготовитель: Россия;;false;false;Люминесцентные лампы купить в Минске, цены, фото, отзывы;;;Купить люминесцентные лампы с доставкой по Минску и Беларуси в магазине bereg.by. Люминесцентные лампы по низким ценам. Звоните +375 (17) 279-43-54!;
111779;111778;Прожекторы светодиодные;Progektor_cvetodiod_PFL_10_50W_GR_Electrotexnika.jpg;Область применения: для освещения фасадов зданий, строительных объектов, подъездных дорог, рекламных стендов, вывесок ^Описание: угол освещения - 120°, класс пылевлагозащищенности - IP65, индекс цветопередачи - Ra ? 75^Температура окруж. среды: -40 - +45^Напряжение, В: входное напряжение - 85-245^Производитель: JazzWay^Страна изготовитель: Китай;;false;false;Светодиодные прожекторы купить в Минске, цены, фото, отзывы;;;Купить светодиодные прожекторы с доставкой по Минску и Беларуси в магазине bereg.by. Светодиодные прожекторы по низким ценам. Звоните +375 (17) 279-43-54!;
111780;111778;Лампы светодиодные;Lampa_cvetodiod_PLED_T8_GL_stekl_Electrotexnika.jpg;Область применения: для освещения помещений^Производитель: JazzWay^Страна изготовитель: Китай;;false;false;Светодиодные лампы купить в Минске, цены, фото, отзывы;;;Купить светодиодные лампы с доставкой по Минску и Беларуси в магазине bereg.by. Светодиодные лампы по низким ценам. Звоните +375 (17) 279-43-54!;
115163;111780;Лампы светодиодные цоколь Е27;;;;false;false;;;;;
115164;111780;Лампы светодиодные цоколь Е14;;;;false;false;;;;;
115165;111780;Лампы светодиодные цоколь G (штырьковый);;;;false;false;;;;;
111802;111740;Аксессуары к корпусам;Kontaktnaya_shina_3_POLE_shtyr_Electro.jpg;;;true;false;Купить аксессуары для электрических шкафов, электрооборудования;Аксессуары к электрокорпусам;;Аксессуары к электрокорпусам, дин-рейки, зажими, шины, изоляторы в Минске по низким ценам с гарантией производителя.;"<h2>Аксессуары для электрошкафов</h2><p><img alt=""аксессуары к корпусам"" src=""//i/photo/aksesuari_korpusa.jpg"" style=""float:right; width:300px"" /></p><p>При изготовлении электрощитового оборудования применяется ряд аксессуаров, назначением которых является обеспечение целостности конструкции и возможности монтажа дополнительной техники. В каталоге нашей компании вы найдете ряд полезных деталей для повышения функциональности электрошкафов.</p><h2>Аксессуары в ассортименте</h2><ul>	<li>Клеммные зажимы. Изготавливаются из устойчивого к возгоранию пропилена. Устанавливаются в электрических цепях, номинальное напряжение которых не превышает 400 В, а частота - 50 Гц. Дают возможность соединять проводники с помощью винтов, предотвращают короткие замыкания на корпус. Токоведущие пластинки сделаны из нержавеющей стали, что повышает срок бесперебойной эксплуатации. Используя <strong>зажим клеммный </strong><strong>JXB</strong>, можно создать эффективную систему распределения нагрузки и повысить удобство эксплуатации оборудования. Аксессуар используется не только в шкафах и щитах, но и в другом оборудовании - например, насосах и дизель-генераторах.</li>	<li>DIN-рейка. Используется для фиксации модулей прямо в корпуса электрошкафов. Длина варьируется в широких пределах (измеряется в мм). Рекомендуем <strong>купить дин-рейку</strong>, если вы намерены расширить функциональность агрегата или установить клеммный зажим. Для устойчивости к коррозии изделия подвергаются оцинковке. Перфорация упрощает монтаж. Для фиксации применяются зажимы.</li>	<li>Изоляторы. Тип &laquo;бочонок&raquo;. Оснащаются болтом. Изготавливаются из устойчивых к высоким температурам материалов. Выдерживают динамические нагрузки при коротких замыканиях. <strong>Силовой изолятор </strong><strong>sm</strong><strong>35</strong> предназначен для установки токоведущих шин в силовые шкафы и сборки. Аксессуар дает возможность зафиксировать и изолировать уязвимые компоненты корпуса и других частей шкафа, а также подключить проводники для распределения электричества. Для крепления изолятора применяется болт, шина устанавливается с противоположной стороны.</li>	<li>Соединительные шины типа PIN. Изготавливаются из меди (варианты на 100А подвергаются лужению), помещаются в корпус из диэлектрического материала. Устойчивы к горению. Предназначены для монтажа модулей определенной ширины.</li></ul><p>С помощью аксессуаров вы повысите безопасность и удобство эксплуатации электрооборудования. Изделия применяются для ремонта техники, дают возможность восстановить функциональность использующегося длительное время шкафа. Каждый экземпляр многократно протестирован на устойчивость к нагрузкам. При изготовлении используются только совместимые с воздействием электроэнергии материалы.</p><h2>Преимущества покупки в компании &laquo;Чистый берег&raquo;</h2><p>Всегда в наличии большой ассортимент продукции разного назначения. Предоставляем услуги физическим и юридическим лицам. Возможна доставка по Минску и в любой другой город Беларуси. Оплата осуществляется наличными деньгами, банковской картой онлайн или через терминал.</p><p>Закажите аксессуары прямо сейчас!</p><p>Ознакомьтесь со всей представленной <a href=""https://www.bereg.by/cat/111740.html""  title=""Электротехника в Минске"">электротехникой</a> в нашем каталоге.</p>"
114244;111802;Заглушка;;;;false;false;;;;;
111813;111802;"Шина ""N"" нулевая с изолятором на DIN-рейку";Kontakt_shina_kreplenie_DIN_rejky_ZD_WAYS_yellow.jpg;Область применения: используется для удобного соединения автоматических выключателей^Производитель: WENZHOU TOSUN ELECTRIC CO., LTD^Страна изготовитель: Китай;;false;false;;;;;
111816;111802;Контактная шина;Kontaktnaya_shina_3_POLE_shtyr_Electro.jpg;Область применения: используется для удобного соединения автоматических выключателей^Производитель: WENZHOU TOSUN ELECTRIC CO., LTD^Страна изготовитель: Китай;;false;false;;;;;
111819;111802;DIN-рейка;DIN_rejka_1_MX1MM.jpg;Область применения: для крепления модульной аппаратуры в корпусах электрошкафов^Производитель: WENZHOU TOSUN ELECTRIC CO., LTD^Страна изготовитель: Китай;;false;false;;;;;
