id;parent_id;Наименование;ИмяФайлаИзображения;Свойства;Документация;Новинка;Спецпредложение;Заголовок;Подзаголовок;КлючевыеСлова;Описание;ТекстОптимизации
107428;105755;Электроприводы к затворам VP3448-02EP;Privody_dlya_zatvorov.jpg;Материал корпуса: алюминий^Среда: воздух^Область применения: для управления запорной промышленной трубопроводной арматурой^Напряжение, В: 220^t мах, °С: от -30 до +40^Производитель: ГЗ Электропривод^Страна изготовитель: Россия;12259;false;false;;;;;
103063;;Компенсаторы;;;;false;false;Купить компенсаторы в Минске по доступной цене;Компенсаторы для труб;;"Компенсоторы в Минске от ЗАО ""Чистый берег"". Качественная продукция. Ведущие поставщики. Гарантия. Доставка. +375172794354";"<p>Компенсаторы для труб &ndash; важные элементы системы отопления, предназначенные для компенсации изменений размеров труб при их нагревании и остывании. Они также способны погасить вибрации от работающего насосного оборудования. В интернет-магазине &laquo;Чистый берег&raquo; можно приобрести муфтовые или фланцевые компенсаторы.</p><h2>Преимущества наших компенсаторов</h2><p>Мы реализуем такие изделия французской компании Tecofi. Компенсаторы этого бренда отличаются высокой надежностью и практичностью. Они обладают простым монтажом и способны справится со всеми нагрузками, которые появляются во время использования отопительной системы. &nbsp;</p><p>Компенсаторы для труб не требуют постоянного обслуживания. Их компактные габариты и легкий вес позволит установить такие изделия в самых труднодоступных местах.</p><h2>Сфера использования</h2><p>Такое сантехническое оборудование используется в системах отопления и кондиционирования. Компенсаторы способны защитить трубопровод от расширения и вибраций. Использование таких элементов способно продлить долговечность инженерных систем вашего дома.</p><h3>Рекомендации по выбору</h3><p>Выбирать компенсатор нужно точно также, как и другую арматуру. То есть, основываясь на показателях допустимых диаметров. В нашем каталоге представлены компенсаторы с диаметром 40 &ndash; 400 мм. Еще одними важными показателями являются максимальное давление и температура. Мы можем вам предложить компенсаторы, выдерживающие 10 &ndash; 25 Бар, и способные работать в среде от 60 до 100 градусов. &nbsp; &nbsp;</p>"
107394;103063;Компенсаторы;kompensator_flancevij_tecofi.jpg;;;false;false;;;;;
107395;107394;Компенсаторы муфтовые;kompensator_myftovij_tecofi.jpg;Материал: резина^Материал уплотнения: ЭПДМ^Область применения: позволяет гасить движения, температурные деформации, вибрации, смещения, компенсировать недостаток^Тип присоединения: муфтовое^Ру, МПа: 1,0^Рабочий диапазон температур: -10+110^Производитель: Tecofi^Страна изготовитель: Франция;123558;false;false;;;;;
107396;107394;Компенсаторы фланцевые;kompensator_flancevij_tecofi.jpg;Материал: резина^Покрытие: ЭПДМ^Среда: вода^Область применения: позволяет воспринимать и гасить движения, температурные деформации, вибрации, смещения^Тип присоединения: фланцевый^Ру, МПа: 1,0^Рабочий диапазон температур: -10- +110^Комплектация: компенсатор в сборе^Производитель: Tecofi^Страна изготовитель: Франция;123560;false;false;;;;;
6749;;Радиаторы;;;;false;false;Радиаторы отопления купить в Минске, цены, фото;;;У нас Вы можете купить радиаторы отопления по приемлемым ценам в Минске в компании Чистый Берег. У нас широкий выбор радиаторов отопления различных производителей;"<p align=""justify"">Компания «Чистый берег» в Минске представляет радиаторы отопления для квартиры и необходимые для монтажа аксессуары. Являясь важным компонентом системы отопления, радиатор обеспечивает нагрев воздуха в помещении, отдавая поступающее тепло от теплоносителя и создавая комфорт и уют в доме.</p><p align=""justify"">Задумывая ремонт или проектируя индивидуальный дизайн помещения, важно правильно выбрать и купить радиатор отопления в квартиру в Минске, полностью соответствующий не только эстетическим, но практическим жизненным требованиям.</p><p align=""justify"">Для того, чтобы не ошибиться в большом ассортименте представленного отопительного оборудования и не превышать запланированный уровень цены на радиаторы отопления, которые Вы собрались купить в Минске, следует знать основные особенности предлагаемых радиаторов отопления в квартиру.</p><p align=""justify"">Основные требования с практической точки зрения к радиатору отопления предъявляет имеющаяся в квартире система отопления. Ее основные параметры формируют запрос характеристик к выбору радиатора – давление в системе, вид теплоносителя. Очень значимой является площадь обогреваемого помещения – от этого зависит количество секций и вид радиатора отопления, сколько радиаторов потребуется на помещение, какова цена приобретения необходимого количества радиаторов отопления. И, конечно же, не стоит забывать от массо-габаритных и эстетических свойствах радиаторов отопления для квартиры – их внешний вид надолго «пропишется» в квартире.</p><p align=""justify"">Компания «Чистый берег» предлагает купить наиболее популярные модели радиаторов отопления для квартиры, полностью адаптированных под условия эксплуатации в Минске:</p><ul align=""justify""><li>алюминиевые;</li><li>стальные;</li><li>чугунные.</li></ul><p align=""justify"">Для удобства покупателей предлагаем полные комплекты сопутствующих каждому виду радиаторов аксессуаров и монтажных элементов, комплектующих.</p><p align=""justify"">Современные <strong>алюминиевые радиаторы</strong> – отличное решение, соответствующее как эстетическим представлениям о современном дизайне квартир, так и практическое воплощение необходимых технических характеристик. Стильный, интересный дизайнерский подход к внешнему виду алюминиевых радиаторов скрывает под собой наиболее высокую теплоотдачу, способность работать в системах отопления с высоким давлением, небольшой вес в сочетании с компактными размерами.</p><p align=""justify""><strong>Стальные радиаторы</strong> по типу исполнения подразделяются на панельные и трубчатые. Высокие антикоррозийные свойства стальных радиаторов, обеспеченные современной методикой покраски, удобство монтажа за счет простоты конструкции и вариантов подключения, невысокая стоимость покупки в Минске, широта предназначения в зависимости от рабочего давления, возможность безграничного выбора по размерам и количеству секций – все это составляющие популярности, из-за которых стальные радиаторы стремятся купить в Минске не только застройщики, но и для замены старых.</p><p align=""justify"">Наибольшей долговечностью обладают <strong>чугунные радиаторы</strong>. Им также присущи высокая прочность, достаточно большое выделение тепла, значительная антикоррозионная стойкость. Классический дизайн советского стиля чугунных радиаторов соседствует с поддержкой высокого давления системы центрального отопления, однако в компании «Чистый берег» представлены и современные привлекательные модели чугунных радиаторов, которые можно купить. Эксплуатационные характеристики чугунных радиаторов подтверждены временем, они также рекомендуются на замену старых.</p><p align=""justify""><strong>Покупая радиаторы отопления в компании «Чистый берег», Вы получаете:</strong></p><ul align=""justify""><li>стильный и современный внешний вид отопительного прибора;</li><li>возможность широкого выбора;</li><li>полное соответствие необходимых характеристик отопительного радиатора вашим расчетам и ожиданиям;</li><li>отличные условия покупки – оптимальные цены, гарантийные обязательства, гибкая система скидок, быстрое обслуживание, предварительную техническую консультацию.</li></ul><p align=""justify"">Все радиаторы, представленные в каталоге, соответствуют требованиям ГОСТ 31311-2005.</p>"
6750;6749;Общие аксессуары для радиаторов;R460HX011_Radiatory.jpg;;;false;false;;;;;
108739;6750;Узел проходной для радиаторов;yzel_obvjazki_radiatora_r470f_giacomini.jpg;Материал корпуса: латунь (хром)^Материал уплотнения: ЭПДМ^Среда: холодная и горячая вода^Ру, МПа: 1,0 - в комплекте с терм. головкой, 1,6 - в ручном режиме^t мах, °С: 110 при P 10^Тип присоединения: резьбовой^Производитель: Giacomini^Страна изготовитель: Италия;12570;false;false;;;;;
108740;6750;Узел угловой для радиаторов;yzel_obvjazki_radiatora_r470f_giacomini.jpg;Материал корпуса: латунь (хром)^Материал уплотнения: ЭПДМ^Среда: холодная и горячая вода^Тип присоединения: резьбовой^Ру, МПа: 1,0 - в комплекте с терм. головкой, 1,6 - в ручном режиме^t мах, °С: 110 при P 10^Производитель: Giacomini^Страна изготовитель: Италия;12570;false;false;;;;;
6755;6750;Воздухоотводчики ручные латунные;vozdyhootvodchik_rychnoj.jpg;Материал корпуса: латунь (хром)^Среда: холодная и горячая вода^Область применения: для систем водоснабжения, отопления и тёплого пола^Производитель: Giacomini^Страна изготовитель: Италия;12404;false;false;;;;;
6759;6750;Головки термостатические;R460HX011_Radiatory.jpg;Материал корпуса: технический пластик^Среда: горячая вода^Область применения: для систем отопления и тёплого пола^Ру, МПа: 1,0^t мах, °С: 110 при P 10;12569,124,121342;false;false;;;;;
6751;6750;Воздухоотводчики автоматические;vozdyhootvodchik_avto_r88i_r200_giacomini.jpg;Материал корпуса: латунь (хром)^Среда: холодная и горячая вода^Область применения: для систем водоснабжения, отопления и тёплого пола^Производитель: Giacomini^Страна изготовитель: Италия;12101;false;false;;;;;
108959;6750;Комплект клапанов;Komplekt_zapor_regylir_klapanov_R705KX003_ygl_Radiatory.jpg;Материал: латунь^Материал уплотнения: ЭПДМ^Область применения: для систем водоснабжения, отопления^Среда: холодная и горячая вода^Тип присоединения: резьбовой^Ру, МПа: 1,6^t мах, °С: 110 при P 10^Производитель: Giacomini^Страна изготовитель: Италия;12577;false;true;;;;;
107091;6750;Фитинг-переходник;Nippel_latun_R180RY_Radiatory.jpg;Материал: латунь (хром)^Область применения: для соединения труб трубопроводов систем отопления из медных и полимерных труб^Ру, МПа: 1,0^t мах, °С: 110^Производитель: Giacomini^Страна изготовитель: Италия;;false;false;;;;;
108732;6750;Клапаны термостатические для термостатической головки;Klapan_termost_bolshoj_proxod_nikelir_2202_02_000.jpg;Материал корпуса: никелированная бронза^Материал уплотнения: ЭПДМ^Среда: холодная и горячая вода^Область применения: для систем водяного отопления зданий и сооружений^Тип присоединения: муфтовое^Ру, МПа: 1,0^t мах, °С: 120;123854;false;false;;;;;
107085;6750;Ниппели;Nippel_latun_R180RY_Radiatory.jpg;Материал: латунь^Область применения: для соединения труб трубопроводов систем отопления из медных и полимерных труб^Ру, МПа: 1,0^t мах, °С: 110^Производитель: Giacomini^Страна изготовитель: Италия;;false;false;;;;;
107087;6750;Переходники;Perexodnik_latun_R93Y006_Radiatory.jpg;Материал: латунь^Область применения: для соединения труб трубопроводов систем отопления из медных и полимерных труб^Ру, МПа: 1,0^t мах, °С: 110^Производитель: Giacomini^Страна изготовитель: Италия;;false;false;;;;;
109559;6750;Воздухоотводчики автоматические серии VASA;Vozduxovodchik_avtom_VASA.jpg;Материал корпуса: никелированная латунь CW 617N UNI EN 12165^Материал уплотнения: EPDM и NBR^Материал поплавка: рычажный из полипропилена^Область применения: устанавливают в системах с положительными давлениями на всасывании^Среда: вода, вода+гликол 30%^Тип резьбы: M UNI-EN-ISO-228^Покрытие: сатинированное никелированное^Ру, МПа: 0,6^t мах, °С: 100^Производитель: R.B.M.^Страна изготовитель: Италия;121211;false;false;;;;;
108738;6750;Клапаны ручные угловые;klapan_rychnoj_yglovoj_r5tg_giacomini.jpg;Материал корпуса: латунь^Материал уплотнения: ЭПДМ^Среда: холодная и горячая вода^Область применения: для систем водоснабжения, отопления^Тип присоединения: резьбовой^Ру, МПа: 1,6^t мах, °С: 110 при P 10^Производитель: Giacomini^Страна изготовитель: Италия;12114,12113;false;false;;;;;
108735;6750;Клапаны отсечные прямые;Klapan_pryamoj_otsech_R15X033_Radiatory.jpg;Материал корпуса: латунь^Материал уплотнения: ЭПДМ^Среда: холодная и горячая вода^Область применения: для систем водоснабжения, отопления^Тип присоединения: резьбовой^Ру, МПа: 1,6^t мах, °С: 110 при P 10^Производитель: Giacomini^Страна изготовитель: Италия;12571,12114;false;false;;;;;
108730;6750;Клапаны осевые для термостатической головки;klapan_osevoj_dlja_term_gol_r415_giacomini.jpg;Материал корпуса: латунь (хром)^Материал уплотнения: EPDM^Среда: холодная и горячая вода^Область применения: для систем водоснабжения, отопления^Тип присоединения: резьбовой^Ру, МПа: 1,0 - в комплекте с терм. головкой, 1,6 - в ручном режиме^t мах, °С: 110 при P 10;12572,123887;false;false;;;;;
108731;6750;Клапаны угловые для термостатической головки;termostat_klapan_yglovoj_dlja_kollektora_giacomini.jpg;Материал корпуса: латунь (хром)^Материал уплотнения: ЭПДМ^Среда: холодная и горячая вода^Область применения: для систем водоснабжения, отопления^Тип присоединения: резьбовой^Ру, МПа: 1,0 - в комплекте с терм. головкой, 1,6 - в ручном режиме^t мах, °С: 110 при P 10;12572,123887,12570;false;false;;;;;
108733;6750;Клапаны прямые для термостатической головки;termostat_klapan_prjamoj_dlja_kollektora_giacomini.jpg;Материал корпуса: латунь (хром)^Материал уплотнения: ЭПДМ^Среда: холодная и горячая вода^Область применения: для систем водоснабжения, отопления^Тип присоединения: резьбовой^Ру, МПа: 1,0 - в комплекте с терм. головкой, 1,6 - в ручном режиме^t мах, °С: 110 при P 10^Производитель: Giacomini^Страна изготовитель: Италия;12572,123887,12113;false;false;;;;;
108737;6750;Клапаны ручные прямые;klapan_rychnoj_prjamoj_r6tg_giacomini.jpg;Материал корпуса: латунь^Материал уплотнения: ЭПДМ^Область применения: для систем водоснабжения, отопления^Среда: холодная и горячая вода^Тип присоединения: резьбовой^Ру, МПа: 1,6^t мах, °С: 110 при P 10^Производитель: Giacomini^Страна изготовитель: Италия;12114;false;false;;;;;
108736;6750;Клапаны отсечные угловые;otsechnoj_klapan_yglovoj_giacomini.jpg;Материал корпуса: латунь^Материал уплотнения: ЭПДМ^Среда: холодная и горячая вода^Область применения: для систем водоснабжения, отопления^Тип присоединения: резьбовой^Ру, МПа: 1,6^t мах, °С: 110 при P 10^Производитель: Giacomini^Страна изготовитель: Италия;12571,12114;false;false;;;;;
