id;parent_id;Наименование;ИмяФайлаИзображения;Свойства;Документация;Новинка;Спецпредложение;Заголовок;Подзаголовок;КлючевыеСлова;Описание;ТекстОптимизации
113277;;Водонагреватели;;;;false;false;Водонагреватели купить в Минске. Цены на бойлеры, фото;Водонагреватели;;Купить нагреватель воды с доставкой по Минску и Беларуси в магазине bereg.by. Водонагреватели по низким ценам. Звоните +375 (17) 279-43-54!;"<img style=""float: right; width: 200px;"" src=""/i/photo/333.jpg"" alt="""" /><h2><strong>Какой водонагреватель выбрать</strong></h2>Отключение горячей воды существенно снижает уровень комфорта в квартире. Чтобы всегда иметь возможность помыть посуду, принять душ или ванную, <strong>купите водонагреватель в Минске</strong>, обратившись в компанию «Чистый берег». В наличи <a href=""https://www.bereg.by/cat/107397.html"">газовые</a> и электрические модели разного типа.<h3><strong>Проточные нагреватели</strong></h3>Проходящая сквозь них жидкость почти мгновенно нагревается до температуры в 45-60 C. Размеры - небольшие, установка простая и быстрая.Главным параметром при выборе является мощность. В проточных разновидностях она варьируется от 3 до 27 кВт. Чем мощнее, тем быстрее будет повышаться температура жидкости. При выборе учитывайте качество проводки в доме - не везде можно использовать самые «быстрые» варианты.Модели мощностью до 8 кВт подключаются в стандартные однофазные розетки на 220 В. Если показатель сильно выше, потребуется трехфазная розетка на 380 В. Имеет значение и количество выдаваемой в минуту жидкости. Самые простые разновидности нагревают до 6 л/мин (этого хватит, чтобы помыть посуду). Лучшие варианты обеспечивают до 17 л/мин (достаточно, чтобы принять душ). По способу установки проточные агрегаты подразделяются на напорные и безнапорные:<ul><li>напорные монтируются прямо в стояк (оптимальный вариант для городской квартиры);</li><li>безнапорные размещаются рядом с точкой водозабора, а значит, их удобнее использовать в загородных домах.</li></ul>Обратившись в нашу компанию, вы можете <strong>купить недорогой водонагреватель в Минске</strong>. Всегда в наличии компактные и мощные разновидности.<h3><strong>Накопительные нагреватели</strong></h3>Вода поступает в специальный контейнер, накапливается и нагревается в нем. Такой вариант подойдет, если вам нужно большое количество жидкости. Объем может составлять от 10 до 500 л (в домах и квартирах востребованы варианты емкостью до 150 л). Занимают больше места, чем накопительные, но обеспечивают запас водного ресурса. <a href=""https://www.bereg.by/cat/109007.html"">Накопительные бойлеры</a> работают от розетки в 220 В, поскольку их мощность невысока. При выборе учитывайте следующие параметры.<ul><li>Объем. Чем он больше, тем большее количество воды удастся нагреть, однако при этом возрастает и время на подогрев. Например, модель на 10 л повышает температуру до 45 С за 10 мин, а 100 л - за несколько часов. На одного человека хватает 80 л, на двоих - 120 л, троим понадобится около 150.</li><li>Способ установки (напольный и настенный). Настенные экономят пространство, но требуют относительно сложного монтажа.</li></ul><h3><strong>Электричество или газ?</strong></h3> В качестве источника энергии колонки и бойлеры используют электросеть, магистральный или сжиженный газ. Каждый вариант имеет свои преимущества.<ul><li> Газовые разновидности дешевле в эксплуатации, поскольку топливо для них стоит относительно немного.</li><li>Электрические проще в установке. Не потребуется получать разрешения контролирующих органов, не нужно монтировать вентиляцию.</li></ul><h3><strong> Нагреватели малого объема</strong></h3> Устанавливаются под мойку/раковину или над ней. Имеют небольшой объем (обычно 10 л), расходуют небольшое количество энергии. Пригодны для мытья посуды или рук, получения жидкости для уборки квартиры. Интересный вариант - <a href=""https://www.bereg.by/cat/113134.html"">кран-нагреватель</a>. Он устанавливается вместо обычного крана и действует как «классическая» проточная модель. В компании <a href=""https://www.bereg.by"">«Чистый берег»</a> вы можете <strong>купить водонагреватель в Минске</strong> по невысокой <strong>цене</strong>. Для вас - удобные способы оплаты (наличными и картой), а также доставка по всей Республике Беларусь."
109006;113277;Водонагреватели с узким диаметром;Ariston_ABS_PRO_ECO_PW_SLIM_i_ABS_PRO_ECO_SLIM.jpg;Материал: нержавеющая сталь^Тип: накопительный^Примечание: с  ускоренным нагревом воды, эксклюзивным покрытием бака Ag+ и электронным термостатом ^t мах, °С: 80^Напряжение, В: 230^Производитель: Ariston^Страна изготовитель: Россия;12743,12740,12742,12744;false;true;;;;;
109007;113277;Водонагреватели стандартных размеров;Ariston_ABS_PRO_ECO_ABS_PRO_ECO_PW.jpg;Материал: нержавеющая сталь^Тип: накопительный^Примечание: с  ускоренным нагревом воды, эксклюзивным покрытием бака Ag+ и электронным термостатом ^t мах, °С: 80^Напряжение, В: 230;12741,12742,12680,12747,12745;false;false;;;;;
109008;113277;Водонагреватель малого объёма (над/под мойкой);Ariston_ABS_SHAPE_SMALL.jpg;Материал: нержавеющая сталь^Тип: накопительный^t мах, °С: 75^Напряжение, В: 230^Примечание: способ нагрева - электричество ^Производитель: Ariston;12746;false;false;Водонагреватели под мойку купить в Минске. Цены, фото;;;Купить водонагреватели под мойку с доставкой по Минску и Беларуси в магазине bereg.by. Водонагреватели под мойку по низким ценам. Звоните +375 (17) 279-43-54!;"<p><img alt="""" src=""/i/photo/222.jpg"" style=""float:right; width:200px"" /></p><h2><strong>Компактные нагреватели для воды</strong></h2><p><strong>Водонагреватель под мойку</strong> - компактный прибор для подогрева сравнительно небольшого количества воды (достаточного для мытья посуды и других хозяйственных нужд). Подводка такого приспособления размещается на верхней части корпуса, что дает возможность легко установить его в кухонном шкафчике. Также существуют <strong>водонагреватели над мойкой</strong> - обычно проточные, закрепляющиеся на стене.</p><h3><strong>Преимущества нагревателей малого объема</strong></h3><ul><li>Небольшой размер. Вам не придется думать, куда передвинуть вещи. Такие модели сочетаются с любым интерьером. При необходимости технику можно полностью спрятать в небольшой тумбе.</li><li>Экономичность. Небольшие приспособления расходуют минимум электроэнергии, а значит, вам не придется переплачивать за ресурс.</li><li>Высокая скорость работы. В проточных вариантах жидкость нагревается в ту же секунду, как вы повернете кран.</li></ul><p>Рекомендуем <strong>купить водонагреватель под мойку</strong>, если сантехника санузла и ванной получает воду от двух разных стояков. В обычном случае пришлось бы монтировать два дорогостоящих нагревателя или тянуть горячий трубопровод из одного помещения в другое. Небольшая и недорогая модель под раковину устраняет проблему.</p><h2><strong>Как сделать выбор</strong></h2><p>Основной параметр - вместительность бака.</p><ul><li><strong>Водонагреватель под мойку на 10 литров</strong>. Один из самых распространенных вариантов. Лучше всего подходит для одного-двух человек. Расходует минимум энергии, выдает достаточное количество воды для мытья посуды.</li><li>Бак на 15 л. Для тех, кто регулярно готовит на большое количество людей.</li><li>20 л. Нагреваемой им воды хватит, чтобы принять душ нескольким людям, однако и энергии расходуется больше, чем в предыдущих вариантах.</li></ul><p>Существуют и более вместительные варианты (25-30 л), но они встречаются не слишком часто.</p><h3><strong>Как устроен такой нагреватель</strong></h3><p>Он представляет собой закрытую конструкцию, которая состоит из нескольких элементов.</p><ul><li>Корпус. Изготавливается из листовой стали или полированного алюминия. Покрывается эмалью для защиты от внешних воздействий. От его формы и размера зависит удобство монтажа приспособления.</li><li>Теплоизолятор. Изготавливается из полиуретана, поролона или аналогичных материалов. Находится под корпусом. Защищает воду от слишком быстрого охлаждения.</li><li>Емкость. <strong>Накопительные водонагреватели под мойку</strong> оснащаются контейнерами, в которых собирается жидкость. Емкость изготавливается из нержавеющей стали или меди, изнутри покрывается эмалью, керамикой или стеклом.</li><li>Патрубки (входные и выходные). Через них подается холодная вода и выходит горячая. Часто имеется запорная арматура, с помощью которой можно перекрыть подачу жидкости.</li><li>Нагревательный элемент. Бывает &laquo;сухим&raquo; и &laquo;мокрым&raquo;. &laquo;Мокрый&raquo; контактирует с жидкостью, &laquo;сухой&raquo; размещается в металлической трубке. Второй вариант более долговечен, поскольку на нем не скапливается накипь.</li><li>Магниевый анод. Защищает основные компоненты от коррозии. Служит около 5 лет, после чего нуждается в замене.</li><li>Термодатчик. Контролирует температуру воды и отключает подогрев по достижению определенного показателя.</li></ul><p>В компании &laquo;Чистый берег&raquo; вы можете купить нагреватели для воды оптом и в розницу, а также иное сантехническое оборудование. Не обязательно ехать за покупкой - доставим ее по указанному при заказе адресу, по всей Республике Беларусь. Подробнее об условиях доставки - в разделе &laquo;Доставка и оплата&raquo;.</p>"
107397;113277;Водонагреватели газовые;Gaz_vodonagrevatel_FAST_CF11P.jpg;Материал: нержавеющая сталь^Тип: проточный^Конструкционные особенности: вертикальная, нижняя подводка, способ крепления - настенный^t мах, °С: 60^Примечание: газовый, возможность работы на сжиженном газе;12856,12855,121449,12966;false;true;Газовые водонагреватели, бойлеры купить в Минске. Цены;;;Купить газовые нагреватели с доставкой по Минску и Беларуси в магазине bereg.by. Водонагреватели на газу по низким ценам. Звоните +375 (17) 279-43-54!;"<img src=""/i/photo/111.jpg"" alt="""" align=""right"" border=""0px"" width=""200""></p><strong>Газовый водонагреватель (колонка)</strong> - приспособление для подогрева воды. Оснащается теплообменником и нагревательным элементом, который работает на природном газе. Розжиг бывает автоматическим (активируется при поступлении воды) и полуавтоматическим (нужно нажимать кнопку для начала работы).</p><h2><strong>Проточные газовые нагреватели</strong></h2><p>Отличаются сравнительно компактными размерами и безопасностью. Главным достоинством проточных газовых колонок является мгновенный подогрев жидкости. Вода нагревается, проходя по змеевику приспособления, так что пользоваться ей можно без ожидания, сразу после включения.</p><p>Современные модели оснащаются термостатами, благодаря чему удается поддерживать выбранную температуру. Для установки необходимо наличие постоянного газа из магистральной сети. Производительность варьируется в зависимости от модели (от 5 до 17 л/мин).</p><p>По способу розжига такие нагреватели подразделяются на 3 вида:</p><ul><li>пьезо (газ зажигается искрой пьезоэлемента);</li><li>электронные (с батарейками);</li><li>с гидрогенератором (горелка включается минитурбиной).</li></ul><p>При выборе обратите внимание на следующие параметры.</p><ul><li>Производительность. Моделей с производительностью до 10 л хватает, чтобы помыть посуду и принять душ. От 11 до 14 л - то же, но в двух разных точках (например, в ванной и кухне). Больше 14 л хватит для получения достаточно больших объемов воды в нескольких точках.</li><li>Мощность. Варьируется от 17 до 30 кВт. Для одной точки достаточно 20 кВт, для двух - от 24 кВт. Чем выше мощность, тем большее количество жидкости может нагреваться за единицу времени.</li><li>Требования к напору воды. Для работы проточной модели нужно как минимум 0,5 бар. Перед тем как <strong>купить газовый водонагреватель в Минске</strong>, ознакомьтесь с характеристиками водопровода в вашем доме.</li><li>Тип камеры сгорания. Бывает открытым и закрытым. Закрытые разновидности безопаснее, поскольку они не потребляют воздух из помещения.</li></ul><p>Проточная модель - подходящий вариант для городской квартиры. Для загородного дома она вряд ли подойдет из-за особенностей газоснабжения и слабого напора воды.</p><h2><strong>Накопительные нагреватели</strong></h2><p>Отличаются большой емкостью. Способны работать на сжиженном или магистральном газе. Для подогрева воды требуется некоторое время (зависит от конкретной модели). Главное достоинство - возможность получения большого количества горячей жидкости (достаточно, чтобы принять ванну).</p><p>При выборе обратите внимание на ряд характеристик.</p><ul><li>Способ установки. Бывает напольным и настенным. Выбирайте в зависимости от особенностей помещения.</li><li>Объем. Минимальное значение для семьи их 3 человек - 120 л.</li><li>Мощность. Сравнительно невысока по сравнению с накопительными моделями (от 4 до 9 кВт). Чем мощность выше, тем быстрее нагревается вода.</li></ul><p>Газовые нагреватели обладают следующими преимуществами перед электрическими:</p><ul><li>не зависят от электроэнергии, могут работать при ее отсутствии;</li><li>экономичны, поскольку газ стоит дешевле электричества.</li></ul><p>Единственный недостаток - более сложная установка (придется позаботиться о вентиляции).</p><h2><strong>Преимущества покупки в компании &laquo;Чистый берег&raquo;</strong></h2><p>Вы можете купить <strong>газовые водонагреватели </strong>в нашем <strong>интернет-магазине в Минске</strong>. Доступен большой выбор моделей разного типа, оптом и в розницу. Возможна доставка по Минску и всей Республике Беларусь. Оплачивайте покупки удобным для вас способом: наличными, банковской картой онлайн или через терминал.</p>"
