id;parent_id;Наименование;ИмяФайлаИзображения;Свойства;Документация;Новинка;Спецпредложение;Заголовок;Подзаголовок;КлючевыеСлова;Описание;ТекстОптимизации
106728;101186;Консольные, консольно-моноблочные;nasos_centrobezhnij_km.jpg;Область применения: перекачивание чистой, питьевой и производственно-технической воды и др. жидкостей сходных с чистой в^Страна изготовитель: Россия;;false;false;Консольные, моноблочные насосы купить в Минске. Цены;;;Купить консольные насосы с доставкой по Минску и Беларуси. Консольно-моноблочные насосы по самым доступным ценам в магазине bereg.by!;"<img src=""/i/photo/catalog/Agregat_K_100_80_160_Nasosy_big.jpg"" alt=""консольно-моноблочные насосы"" align=""right"" border=""0px"" width=""200""><p><strong>Консольный насос</strong> – это электротехническое устройство, которое создано для перекачивания чистой холодной или горячей воды, с максимальным числом примесей не более 0,1%. Для правильного использования данного агрегата необходимо приобрести модель насоса, подходящую под параметры системы.</p><h2>Как выбрать консольный насос?</h2><p>Чтобы выбрать насос консольного типа нужно учесть следующие параметры:</p><li>мощность устройства;</li><li>дальность и высоту передачи жидкости;</li><li>производительность и объем перекачиваемой жидкости;</li><li>тип конструкции агрегата.</li><p>При <strong>покупке консольного насоса</strong> для системы водоснабжения, необходимо воспользоваться помощью специалистов. Сотрудники нашего магазина с удовольствием помогут вам выбрать такую модель насоса, которая идеально подойдет для вашей системы. Для выбора такой техники обращайтесь к профессионалам.</p><h2>Основные отличия моделей</h2><p>Различаются такие насосы по нескольким критериям. В зависимости от системы водоснабжения, в которой будут использоваться такие агрегаты, производители выпускают различные модели <strong>моноблочных насосов</strong>. Для бытовых нужд часто используются насосы со средними значениями:</p><li>мощность - 30 кВт;</li><li>производительность – 200 м3/час;</li><li>сила напора – 32 метра.</li><li>температура жидкости: от -10 до +850 С.</li><p>Также такие насосы могут отличаться конструктивными особенностями, количеством оборотов электродвигателя и кавитационным запасом. В нашем каталоге представлены различны модели такой техники.</p><p>В нашем магазине вы без труда найдете насос именно для своей системы. Наши консультанты помогут сделать вам правильный выбор. Они всегда готовы решить все ваши проблемы, связанные с выбором такой продукции. Если у вас есть вопросы по этому товару, или вы хотите получить консультацию по другой продукции нашего магазина, то звоните прямо сейчас.</p>"
104265;101186;Монтажный комплект для насосов;Montag_komplekt_dlya_nasosov.jpg;Область применения: для соединения насосов ;;false;false;;;;;
103869;101186;Прочее;Nasos_pogrygnoj_podacha_vody_VP300PUMPS.jpg;;12387,12808;false;false;;;;;
106727;101186;Насосы дренажные ГНОМ;Nasos_Gnom_10_10.jpg;Область применения: перекачивание бытовых и промышленных сточных вод плотностью до 1100 кг/м3^Производитель: ОАО ""Ливгидромаш""^Страна изготовитель: РФ;12462,12344,12345;false;false;Дренажный насос Гном купить в Минске. Цены, отзывы;;;Купить дренажные насосы Гном с доставкой по Минску и Беларуси в магазине bereg.by. Дренажные насосы по самым низким ценам, скидки!;"<p><strong>Дренажный насос Гном</strong> используется для обслуживания загородного дома и при некоторых строительных работах. С помощью такого оборудования легко устранить последствия сильных ливней и подтоплений во время весенних паводков.</p><h2>Преимущества насоса Гном</h2><p>В сравнении с аналогами, такой агрегат обладает следующими преимуществами:</p><ul><li>Простота в эксплуатации.</li><li>Широкий модельный ряд.</li><li>Высокая ремонтопригодность.</li><li>Отсутствие шума во время работы.</li><li>Наличия автоматических систем безопасности.</li></ul><p>В нашей стране насос для откачки <strong>грязной воды</strong> Гном практически не имеет аналогов. Лучшее соотношение &laquo;цена-качество&raquo; сделали его популярным не только в Беларуси, но и далеко за пределами нашей страны.</p><h2>Сфера использования насоса</h2><p><strong>Купить дренажный насос</strong> Гном для проведения различных работ можно в компании &laquo;Чистый берег&raquo;. Такое универсальное оборудование используется для:</p><ul><li>Дренажа грунтовых вод на участке.</li><li>Откачке паводковых вод из подтопленных помещений.</li><li>Очистки заиленных колодцев.</li><li>Осушения строительных котлованов.</li><li>Перекачки жидкости с одной емкости в другую.</li></ul><p>Некоторые модели насосов Гном можно использовать <strong>для канализации</strong>.</p><h3>Рекомендации по выбору</h3><p>Благодаря большому модельному ряду насосов Гном, каждый клиент нашего магазина сможет выбрать для себя то оборудование, которое подойдет для его нужд. При выборе такого насоса обратите внимание на его характеристики и расшифровку модели. Важными показателями насосного оборудования являются напор и производительность. Для полива дачного участка мы рекомендуем насос Мини Гном 7-7. Решение более сложных задач лучше доверить Гному 16-16.</p><p>Хотите <strong>купить дренажный насос в Минске</strong>? Обратите внимание на ассортимент нашего магазина. Мы готовы предоставить вам такое оборудование для решения всех необходимых задач.</p>"
113219;101186;Насосы ЭЦВ - скважинные;Nasosy_ECV_skvaginnye.jpg;Область применения: водоснабжение, дренаж^Материал: нержавеющая сталь, чугун^Гарантия: 12 месяцев^Производитель: ООО ПКП Азовэнергомаш^Страна изготовитель: Украина;122498,121093,121095;true;false;Скважинный насос ЭЦВ купить в Минске. Цены, отзывы;;;Купить скважинный насос ЭЦВ с доставкой по Минску и Беларуси в магазине bereg.by. Скважинный насосы ЭЦВ по самым низким ценам, скидки!;"<p>В нашем интернет-магазине можно<strong>&nbsp;купить скважинный насос ЭЦВ</strong>&nbsp;для решения проблем с водоснабжением своего загородного дома. С помощью такого оборудования можно провести откачку и подачу воды из скважин, колодцев и других глубоководных резервуаров. Такая разновидность наносов используется для орошения, поддержания водоснабжения и подачи воды на нужную высоту.</p><p>В ассортимент нашего магазина входят модели таких насосов ООО ПКП Азовэнергомаш. Продукция этой компании способна работать в условиях нашего климата и характеризуется лучшим соотношением &laquo;цена-качество&raquo; на белорусском рынке.</p><p>Такие насосы имеют удлиненный узкий корпус и монолитную структуру. Благодаря хорошей герметичности внутренних компонентов, насос можно погружать в самые небольшие по диаметру скважины. Конфигурация, представленных в этом каталоге моделей, позволяет их использовать на большой глубине без необходимости защиты от контакта с жидкостью.</p><h2>Применение и разновидности погружных насосов ЭЦВ</h2><p>Важной отличительной особенностью наших насосов является:</p><ul>	<li>небольшие габариты;</li>	<li>высокая надежность;</li>	<li>хороший уровень напора;</li>	<li>длительный срок службы.</li></ul><h2>Как правильно выбрать погружной насос ЭЦВ</h2><p>Надежность и производительность вашей скважины зависит от правильно подобранного оборудования. Выбирая&nbsp;<strong>скважинные насосы в Минске</strong>, обратите внимание на такие параметры:</p><ul>	<li><strong>Диаметр скважины</strong>. При выборе размера насос учтите, что его диаметр должен быть меньше диаметра скважины на 10 мм. В ассортимент нашего магазина входят насосы со &laquo;стандартными&raquo; диаметрами: 3 и 4 дюйма.</li>	<li><strong>Производительность</strong>. Выбирая такой агрегат нужно опираться на максимальную производительность и личные потребности в воде. Для частного дома, в котором проживает 3-4 человека, выбирайте насос, производительностью 2-3 кубометра в час.</li>	<li><strong>Очистка</strong>. В зависимости от типа скважины, могут потребоваться насосы для работы с водой, загрязненной песком или илом. Чем сложнее состав воды, тем дороже оборудования для ее перекачки.</li></ul><h2>Преимущества погружных насосов ЭЦВ</h2><p>Основные преимущества скважинного оборудования для перекачки воды:</p><ul>	<li><strong>Высокий КПД</strong>. Обеспечение необходимого напора при минимальном энергопотреблении.</li>	<li><strong>Способно поднять воду</strong> на высоту до 250 метров.</li>	<li><strong>Плавный пуск</strong>. Снижение изнашивание устройства благодаря защите от перенапряжения.</li>	<li><strong>Небольшие габариты</strong>. Можно разместить в скважине любых размеров.</li>	<li><strong>Комфортная работа</strong>. Наши насосы работают с низким коэффициентом шума.</li>	<li><strong>Быстрый монтаж и настройка</strong>.</li></ul><p><strong>Купить скважинный насос ЭЦВ в Минске</strong>&nbsp;можно в магазине &laquo;Чистый берег&raquo;. Вся представленная на этой странице продукция сертифицирована и допускается для продажи в странах ЕС.</p>"
113123;101186;Насосы UNIPUMP;UNIPUMP_Akvarobot_M_5_15_Nasosy.jpg;Область применения: отопление /дренаж/канализация^Производитель: UNIPUMP^Страна изготовитель: Россия;;false;false;Насосы Unipump купить в Минске. Цены, отзывы, доставка;;;Купить насосы Юнипамп с доставкой по Минску и Беларуси. Насосы Unipump дренажные, фекальные, промышленные по самым низким ценам!;"<img src=""/i/photo/catalog/UNIPUMP_AUTO_JET_80_S_Nasosy_big.jpg"" alt=""насосы Unipump"" align=""right"" border=""0px"" width=""200""><p>Российская компания Unipump была образована в 2000 году. И уже через два года представила на суд публики свои первые насосы. Сегодня продукция этого предприятия широко используется в сфере коммунального хозяйства. <strong>Насосы Юнипамп</strong> применяются для создания автономного водоснабжения дачных домов и загородных коттеджей. С их помощью можно осуществить автоматический полив сада и огорода.</p><h2>Виды оборудования Unipump</h2><p>Воспользовавшись уникальным предложением нашего магазина, вы сможете приобрести по доступной стоимости следующие виды насосов этого бренда:</p><ul>	<li>циркуляционный для отопления;</li><li>вибрационный для водоснабжения;</li><li>погружной для скважины;</li><li>дренажный для чистой и загрязнённой воды;</li><li>фекальный с режущим механизмом для отвода сточных вод.</li></ul><p>Представленные на этой странице агрегаты Unipump обладают высокой надежностью и отличными эксплуатационными качествами. Насосы этого бренда обеспечивают оптимальную мощность и давление воды при подаче. <strong>Купить насос Unipump</strong> можно в нашем интернет-магазине.</p><p>Неоспоримые преимущества этого бренда:</p><ul>	<li>отличное соотношение высоты подачи воды с количеством перекачиваемой жидкости;</li><li>надежность и долговечность агрегатов;</li><li>отсутствие потребности в постоянном техническом обслуживании;</li><li>легкость и простота в эксплуатации;</li><li>адаптированность к климатическим условиям нашей страны;</li><li>надежная защита от возможных перегрузок;</li><li>низкая потребляемая мощность;</li><li>доступная стоимость.</li></ul><p><strong>Насосы Unipump</strong> изготавливаются из качественных материалов и обладают высокой экологической безопасностью. Большинство оборудования этого бренда оснащены электронными системами управления итальянского производителя Italtecnica. Мы уверены, что насосы Unipump доставят вам удовольствие при использовании.</p><p>Вся продукция нашего магазина из этого каталога адаптирована под белорусские условия эксплуатации. Благодаря уникальным разработкам, продукция компании Unipump широко популярна не только в нашей стране, но и поставляется на рынок западной Европы. Этого удалось добиться только благодаря безупречному качеству насосов этого бренда.</p><p>Если у вас есть вопросы по продукции, или вы хотите узнать больше о других товарах из нашего магазина – звоните нам прямо сейчас. Наши специалисты помогут вам решить все вопросы и определиться с выбором товара. Купить насос Юнипамп с нашей помощью очень просто!</p>"
111852;101186;Насосы грунтовые;Nasos_grynt_GRAK_85_40_I.jpg;Область применения: предназначен для перекачивания абразивных гидросмесей ^t мах, °С: 5 - 60^Плотность, кг/м3: 1300 ^Производитель: ЗАО НПО ""Уралгидропром""^Страна изготовитель: Россия;;true;false;Грунтовый насос купить в Минске. Цены, отзывы, доставка;;;Купить грунтовые насосы с доставкой по Минску и Беларуси в магазине bereg.by. Насосы для грунтовых вод по самым низким ценам, скидки!;<p><strong>Грунтовый насос</strong> – это оборудование, которое предназначено для перекачки воды с пульпой (грунтом). Иногда такую технику называют «землесосы». Насосы такого вида используются при разработках котлованов и карьеров, добыче полезных ископаемых и транспортировки грунта. Благодаря своим конструктивным особенностям, таким насосам не страшны абразивные включения в виде песка, мелкой гальки и щебня.</p><h2>Особенности грунтовых насосов</h2><p>В нашем интернет-магазине можно <strong>купить грунтовый насос</strong> российского производителя «Уралгидропром». Это оборудование предназначено для перекачивания водно-песчаных и гравийных смесей. Его можно использовать в составе насосных станций канализационных систем или на горно-разрабатывающих комбинатах.</p><p>Конструктивными особенностями таких насосов являются колесо с лопастями и возможность изменения расстояния между лопастями и стенкой. У такого оборудования обязательно должен быть разборный корпус. Для увеличения долговечности грунтовых насосов их внутреннюю часть покрывают специальным составом, который снижает негативное воздействие на корпус твердых частиц, присутствующих в растворе.</p><p><strong>Насос для грунтовых вод</strong> имеет вал, который крепится к опорам с помощью подшипников. Чтобы в них не попали твердые вещества, они омываются водой. Она подается в район вала с помощью специальной системы. Давление омывающей воды должно быть выше, чем рабочий напор насоса.  </p><h2>Принцип работы грунтового насоса</h2><p>Насосное оборудование этого вида работает следующим образом:</p><ul><li>Выкаченная смесь поступает на колесо.</li><li>Лопасти переносят гидросмесь на трубопровод.</li><li>Действиями центробежных сил происходит отделение пульпы от воды.</li></ul><p>Напор, который вырабатывается при работе такого оборудования, способен перенести гидросмесь на десятки метров.</p><p>Данное насосное оборудование обладает высоким КПД. Насос грунтовый, цена которого вас приятно удивит, обладает этим показателем не ниже 75%. Для работы этого оборудования используется мощный двигатель, но габариты насоса из-за этого не являются громоздкими. Такой насос можно использовать в качестве стационарного или транспортировать на место работы без больших физических усилий.</p><p><strong>Купить грунтовый насос в Минске</strong> можно в нашем интернет-магазине. Мы осуществляем бесплатную доставку такой техники и поможем вам наладить ее работу. Если у вас остались вопросы или вы хотите получить консультацию по другому оборудованию из нашего магазина, то звоните по указанным на этой странице номерам телефона. Наши менеджеры вам обязательно помогут.</p>
